{
  "task_id": "project-1",
  "project_code": "澄岳DCM项目",
  "objective": "使用私人 Agent 整理项目事实、责任、干系人、会议行动项、财务数据和待确认事项",
  "as_of_date": "2026-09-06",
  "loaded_sources": [
    {
      "file": "01_招标文件.docx",
      "version_or_date": "",
      "loaded_at": "2026-09-06 15:58:15"
    },
    {
      "file": "02_投标响应文件.docx",
      "version_or_date": "",
      "loaded_at": "2026-09-06 15:59:18"
    },
    {
      "file": "03_项目合同及补充协议.docx",
      "version_or_date": "",
      "loaded_at": "2026-09-06 16:00:37"
    },
    {
      "file": "04_项目管理计划书.docx",
      "version_or_date": "",
      "loaded_at": "2026-09-06 16:01:56"
    },
    {
      "file": "05_甲乙双方项目团队与负责人清单.xlsx",
      "version_or_date": "",
      "loaded_at": "2026-09-06 16:03:05"
    },
    {
      "file": "06_对方干系人清单.xlsx",
      "version_or_date": "",
      "loaded_at": "2026-09-06 16:03:38"
    },
    {
      "file": "07_会议记录与邮件往来汇编.docx",
      "version_or_date": "",
      "loaded_at": "2026-09-06 16:04:54"
    },
    {
      "file": "08_项目财务报告与付款资料.xlsx",
      "version_or_date": "",
      "loaded_at": "2026-09-06 16:06:01"
    },
    {
      "file": "09_项目问题风险与变更记录.xlsx",
      "version_or_date": "",
      "loaded_at": "2026-09-06 16:07:01"
    }
  ],
  "confirmed_facts": [
    {
      "field": "项目名称",
      "value": "项目协同与经营管理数字化平台建设项目",
      "source": "01_招标文件.docx",
      "status": "confirmed"
    },
    {
      "field": "项目编号",
      "value": "CY-DCM-2026-01",
      "source": "01_招标文件.docx",
      "status": "confirmed"
    },
    {
      "field": "招标编号",
      "value": "CYZB-2026-017",
      "source": "01_招标文件.docx",
      "status": "confirmed"
    },
    {
      "field": "采购控制价",
      "value": "¥3,450,000.00",
      "source": "01_招标文件.docx",
      "status": "confirmed"
    },
    {
      "field": "建设周期",
      "value": "2026年10月20日至2027年4月19日",
      "source": "01_招标文件.docx",
      "status": "confirmed"
    },
    {
      "field": "采购内容",
      "value": "项目协同与经营管理数字化平台的软件许可/订阅、实施、集成、数据迁移、测试、培训、上线和质保服务",
      "source": "01_招标文件.docx",
      "status": "confirmed"
    },
    {
      "field": "建设地点",
      "value": "上海总部及采购人批准的云资源/VPC；必要时覆盖苏州制造中心",
      "source": "01_招标文件.docx",
      "status": "confirmed"
    },
    {
      "field": "成功标准_业务覆盖",
      "value": "本期10个模块范围完成，关键项目全过程可在线管理",
      "source": "01_招标文件.docx",
      "status": "confirmed"
    },
    {
      "field": "成功标准_数据",
      "value": "迁移近3年约320个项目，关键字段准确率不低于99.5%",
      "source": "01_招标文件.docx",
      "status": "confirmed"
    },
    {
      "field": "成功标准_用户",
      "value": "注册用户680人，并发用户不低于300人",
      "source": "01_招标文件.docx",
      "status": "confirmed"
    },
    {
      "field": "成功标准_性能",
      "value": "常用查询95百分位响应时间不超过3秒",
      "source": "01_招标文件.docx",
      "status": "confirmed"
    },
    {
      "field": "成功标准_质量",
      "value": "最终验收时P1/P2缺陷为0，功能测试总体通过率不低于95%",
      "source": "01_招标文件.docx",
      "status": "confirmed"
    },
    {
      "field": "功能模块_F01",
      "value": "项目组合与立项：项目分类、模板、立项申请、评审、优先级、项目组合和状态报告（必须）",
      "source": "01_招标文件.docx",
      "status": "confirmed"
    },
    {
      "field": "功能模块_F10",
      "value": "权限审计：SSO、角色、数据权限、敏感字段、导出控制、操作日志（必须）",
      "source": "01_招标文件.docx",
      "status": "confirmed"
    },
    {
      "field": "接口_OA",
      "value": "组织、审批、待办；实时/准实时；失败重试、状态回写和日志",
      "source": "01_招标文件.docx",
      "status": "confirmed"
    },
    {
      "field": "阶段_启动",
      "value": "2026-10-20至10-30；核心活动：启动、调研、计划和治理；交付物：项目计划、沟通计划、风险清单",
      "source": "01_招标文件.docx",
      "status": "confirmed"
    },
    {
      "field": "阶段_验收",
      "value": "2027-04-19；核心活动：最终验收与运维移交；交付物：验收报告、运维手册、资产清单",
      "source": "01_招标文件.docx",
      "status": "confirmed"
    },
    {
      "field": "信息安全_漏洞要求",
      "value": "上线前完成第三方安全测试，严重和高危漏洞清零",
      "source": "01_招标文件.docx",
      "status": "confirmed"
    },
    {
      "field": "服务等级_P1",
      "value": "系统不可用、核心数据损坏或重大安全事件；响应时间15分钟；4小时内恢复服务，24小时内初步报告",
      "source": "01_招标文件.docx",
      "status": "confirmed"
    },
    {
      "field": "付款节点_合同生效",
      "value": "20%，¥690,000；前提：合同生效、计划和保障到位、合法发票",
      "source": "01_招标文件.docx",
      "status": "confirmed"
    },
    {
      "field": "付款节点_最终验收",
      "value": "25%，¥862,500；前提：最终验收和资料移交完成",
      "source": "01_招标文件.docx",
      "status": "confirmed"
    },
    {
      "field": "税率",
      "value": "6%",
      "source": "01_招标文件.docx",
      "status": "confirmed"
    },
    {
      "field": "质保期",
      "value": "最终验收后12个月",
      "source": "01_招标文件.docx",
      "status": "confirmed"
    },
    {
      "field": "投标有效期",
      "value": "自投标截止之日起90日",
      "source": "01_招标文件.docx",
      "status": "confirmed"
    },
    {
      "field": "投标截止时间",
      "value": "2026年9月28日09:30",
      "source": "01_招标文件.docx",
      "status": "confirmed"
    },
    {
      "field": "发布日期",
      "value": "2026年9月5日",
      "source": "01_招标文件.docx",
      "status": "confirmed"
    },
    {
      "field": "文件状态",
      "value": "学生输入资料 / 教学模拟",
      "source": "01_招标文件.docx",
      "status": "confirmed"
    },
    {
      "field": "教学说明",
      "value": "本资料为课程教学模拟文件。企业、人员、地址、联系方式及业务数据均为虚构，不具有法律、采购、审计或人事效力。",
      "source": "01_招标文件.docx",
      "status": "confirmed"
    },
    {
      "field": "项目名称",
      "value": "项目协同与经营管理数字化平台建设项目",
      "source": "02_投标响应文件.docx",
      "status": "confirmed"
    },
    {
      "field": "招标编号",
      "value": "CYZB-2026-017",
      "source": "02_投标响应文件.docx",
      "status": "confirmed"
    },
    {
      "field": "投标有效期",
      "value": "90日",
      "source": "02_投标响应文件.docx",
      "status": "confirmed"
    },
    {
      "field": "计划进场准备日期",
      "value": "2026-10-15",
      "source": "02_投标响应文件.docx",
      "status": "confirmed"
    },
    {
      "field": "最终验收后质保期",
      "value": "12个月",
      "source": "02_投标响应文件.docx",
      "status": "confirmed"
    },
    {
      "field": "平台授权账号能力",
      "value": "720个",
      "source": "02_投标响应文件.docx",
      "status": "confirmed"
    },
    {
      "field": "并发设计目标",
      "value": "不少于300并发",
      "source": "02_投标响应文件.docx",
      "status": "confirmed"
    },
    {
      "field": "历史数据迁移量",
      "value": "约320个项目",
      "source": "02_投标响应文件.docx",
      "status": "confirmed"
    },
    {
      "field": "关键字段准确率目标",
      "value": "99.5%",
      "source": "02_投标响应文件.docx",
      "status": "confirmed"
    },
    {
      "field": "功能测试通过率目标",
      "value": "不低于95%",
      "source": "02_投标响应文件.docx",
      "status": "confirmed"
    },
    {
      "field": "查询响应性能目标",
      "value": "95百分位响应不超过3秒",
      "source": "02_投标响应文件.docx",
      "status": "confirmed"
    },
    {
      "field": "安全事件响应时效",
      "value": "15分钟响应、1小时内通知采购人",
      "source": "02_投标响应文件.docx",
      "status": "confirmed"
    },
    {
      "field": "乙方项目经理",
      "value": "唐明宇",
      "source": "02_投标响应文件.docx",
      "status": "confirmed"
    },
    {
      "field": "乙方项目经理投入比例",
      "value": "不低于80%",
      "source": "02_投标响应文件.docx",
      "status": "confirmed"
    },
    {
      "field": "关键人员变更机制",
      "value": "提前10个工作日书面申请",
      "source": "02_投标响应文件.docx",
      "status": "confirmed"
    },
    {
      "field": "临时代理规则",
      "value": "短期出差期间可由同等资历人员代行会议协调，但不构成正式项目经理变更",
      "source": "02_投标响应文件.docx",
      "status": "confirmed"
    },
    {
      "field": "投标含税总价",
      "value": "3280000",
      "source": "02_投标响应文件.docx",
      "status": "confirmed"
    },
    {
      "field": "税率",
      "value": "6%",
      "source": "02_投标响应文件.docx",
      "status": "confirmed"
    },
    {
      "field": "不含税合计金额",
      "value": "3094339.62",
      "source": "02_投标响应文件.docx",
      "status": "confirmed"
    },
    {
      "field": "税额合计",
      "value": "185660.38",
      "source": "02_投标响应文件.docx",
      "status": "confirmed"
    },
    {
      "field": "平台软件许可与配置含税金额",
      "value": "1100000.00",
      "source": "02_投标响应文件.docx",
      "status": "confirmed"
    },
    {
      "field": "实施与项目管理含税金额",
      "value": "800000.00",
      "source": "02_投标响应文件.docx",
      "status": "confirmed"
    },
    {
      "field": "接口集成含税金额",
      "value": "550000.00",
      "source": "02_投标响应文件.docx",
      "status": "confirmed"
    },
    {
      "field": "数据迁移含税金额",
      "value": "350000.00",
      "source": "02_投标响应文件.docx",
      "status": "confirmed"
    },
    {
      "field": "测试、培训与质保含税金额",
      "value": "480000.00",
      "source": "02_投标响应文件.docx",
      "status": "confirmed"
    },
    {
      "field": "投标人",
      "value": "杭州远序数字科技有限公司",
      "source": "02_投标响应文件.docx",
      "status": "confirmed"
    },
    {
      "field": "采购人",
      "value": "上海澄岳智能装备有限公司",
      "source": "02_投标响应文件.docx",
      "status": "confirmed"
    },
    {
      "field": "项目名称",
      "value": "项目协同与经营管理数字化平台建设项目",
      "source": "03_项目合同及补充协议.docx",
      "status": "confirmed"
    },
    {
      "field": "项目编号",
      "value": "CY-DCM-2026-01",
      "source": "03_项目合同及补充协议.docx",
      "status": "confirmed"
    },
    {
      "field": "合同编号",
      "value": "CYHT-2026-048",
      "source": "03_项目合同及补充协议.docx",
      "status": "confirmed"
    },
    {
      "field": "建设周期",
      "value": "2026年10月20日至2027年4月19日",
      "source": "03_项目合同及补充协议.docx",
      "status": "confirmed"
    },
    {
      "field": "最终验收日期",
      "value": "2027-04-19",
      "source": "03_项目合同及补充协议.docx",
      "status": "confirmed"
    },
    {
      "field": "质保期",
      "value": "12个月（自最终验收之日起）",
      "source": "03_项目合同及补充协议.docx",
      "status": "confirmed"
    },
    {
      "field": "交付范围",
      "value": "项目组合与立项、WBS与进度、资源与工时、预算与成本、采购与合同、风险问题变更、文档知识、经营看板、通知与移动Web、权限与审计等十个模块；不包括替换ERP/OA/HR/财务系统、原生移动APP、未经批准的新业务模块。",
      "source": "03_项目合同及补充协议.docx",
      "status": "confirmed"
    },
    {
      "field": "甲方项目经理",
      "value": "陈致远",
      "source": "03_项目合同及补充协议.docx",
      "status": "confirmed"
    },
    {
      "field": "乙方项目经理",
      "value": "唐明宇",
      "source": "03_项目合同及补充协议.docx",